{
  "$schema": "https://json-schema.org/draft/2020-12/schema",
  "$id": "https://credflow.local/contracts/events/application.submitted.schema.json",
  "title": "application.submitted",
  "type": "object",
  "properties": {
    "eventId": {
      "type": "string",
      "format": "uuid"
    },
    "eventType": {
      "const": "application.submitted"
    },
    "schemaVersion": {
      "const": "1.0"
    },
    "occurredAt": {
      "type": "string",
      "format": "date-time"
    },
    "producer": {
      "const": "application-service"
    },
    "applicationId": {
      "type": "string",
      "format": "uuid"
    },
    "aggregateVersion": {
      "type": "integer",
      "minimum": 1
    },
    "correlationId": {
      "type": "string",
      "pattern": "^[A-Za-z0-9._:-]{1,100}$"
    },
    "causationId": {
      "type": "string",
      "format": "uuid"
    },
    "data": {
      "type": "object",
      "properties": {
        "sellerId": {
          "type": [
            "string",
            "null"
          ],
          "minLength": 1,
          "maxLength": 120,
          "description": "Trusted Application seller identity; values such as SELLER-1001 are strings, never marketplace seller identifiers. null means mapping required."
        },
        "sellerSubject": {
          "type": "string",
          "minLength": 1,
          "maxLength": 255
        },
        "marketplaceId": {
          "type": "string",
          "format": "uuid"
        },
        "marketplaceSellerId": {
          "type": "string",
          "minLength": 1,
          "maxLength": 120
        },
        "applicationRevision": {
          "type": "integer",
          "minimum": 1
        },
        "requestedAmount": {
          "type": "string",
          "pattern": "^[0-9]{1,17}\\.[0-9]{2}$",
          "not": {
            "pattern": "^0+\\.00$"
          }
        },
        "currency": {
          "const": "INR"
        },
        "loanPurpose": {
          "enum": [
            "PURCHASE_INVENTORY",
            "WORKING_CAPITAL",
            "BUSINESS_EXPANSION"
          ]
        },
        "businessProfile": {
          "type": "object",
          "properties": {
            "displayName": {
              "type": "string",
              "minLength": 1
            },
            "businessName": {
              "type": "string",
              "minLength": 1,
              "maxLength": 255
            },
            "registeredBusinessName": {
              "type": "string",
              "minLength": 1,
              "maxLength": 255
            },
            "businessStartDate": {
              "type": "string",
              "format": "date"
            },
            "contactEmail": {
              "type": "string",
              "format": "email"
            },
            "fixtureIdentityId": {
              "type": "string",
              "minLength": 1
            }
          },
          "required": [
            "businessName"
          ],
          "additionalProperties": true
        },
        "sellerRequestReference": {
          "type": "string",
          "minLength": 1
        },
        "status": {
          "const": "AWAITING_CONSENT"
        }
      },
      "required": [
        "sellerId",
        "marketplaceId",
        "applicationRevision",
        "requestedAmount",
        "currency"
      ],
      "additionalProperties": false
    },
    "actor": {
      "type": "object",
      "properties": {
        "type": {
          "enum": [
            "HUMAN",
            "SYSTEM",
            "SYSTEM_CLIENT"
          ]
        },
        "subject": {
          "type": "string",
          "minLength": 1,
          "maxLength": 255
        },
        "organisationId": {
          "type": "string",
          "format": "uuid"
        }
      },
      "required": [
        "type",
        "subject"
      ],
      "additionalProperties": false
    },
    "originActor": {
      "type": "object",
      "properties": {
        "type": {
          "enum": [
            "HUMAN",
            "SYSTEM",
            "SYSTEM_CLIENT"
          ]
        },
        "subject": {
          "type": "string",
          "minLength": 1,
          "maxLength": 255
        },
        "organisationId": {
          "type": "string",
          "format": "uuid"
        }
      },
      "required": [
        "type",
        "subject"
      ],
      "additionalProperties": false
    }
  },
  "required": [
    "eventId",
    "eventType",
    "schemaVersion",
    "occurredAt",
    "producer",
    "applicationId",
    "aggregateVersion",
    "correlationId",
    "data",
    "actor"
  ],
  "additionalProperties": false,
  "description": "Member 3 proposed canonical envelope accepting the Member 1 trusted string seller identity. This is not the unprovided Member 1 flat event or the current Member 2 Audit UUID-seller template. Producer/consumer agreement and Member 1 publisher remain pending. Absent loan purpose/business name blocks automated checks until context is provided."
}
