{
  "eventId": "b180cf9f-cb72-4c93-85fe-96cd7b52c657",
  "eventType": "application.submitted",
  "schemaVersion": "1.0",
  "occurredAt": "2026-10-16T09:00:00Z",
  "producer": "application-service",
  "applicationId": "52de19d2-1bea-5fd3-9685-868e1a7207b7",
  "aggregateVersion": 1,
  "correlationId": "demo-flow-bank-a-104",
  "data": {
    "sellerId": "SELLER-1001",
    "sellerSubject": "seller-demo-104",
    "marketplaceId": "dd77e60a-5273-5576-b177-e07066692696",
    "marketplaceSellerId": "SELLER-104",
    "applicationRevision": 1,
    "requestedAmount": "500000.00",
    "currency": "INR",
    "sellerRequestReference": "DEMO-104-001",
    "status": "AWAITING_CONSENT"
  },
  "actor": {
    "type": "SYSTEM_CLIENT",
    "subject": "application-service"
  },
  "originActor": {
    "type": "HUMAN",
    "subject": "seller-demo-104"
  }
}
